{
  "$schema": "https://json-schema.org/draft/2020-12/schema",
  "$id": "venthub/trivial",
  "title": "Trivial Fast-Track Artifact",
  "description": "Ufak görevler (typo, import düzelme vb.) için cross-validation zorunluluğunu atlayan ancak Sentinel Guard (Test/Lint) kurallarını işleten özel bir şema.",
  "type": "object",
  "required": [
    "skill",
    "task_id",
    "task_title",
    "description",
    "files_modified",
    "allowed_paths",
    "forbidden_paths",
    "max_files_changed",
    "allowed_change_types",
    "verification_commands",
    "all_passed"
  ],
  "properties": {
    "skill": {
      "type": "string",
      "const": "superpowers-trivial"
    },
    "model": {
      "type": "string"
    },
    "date": {
      "type": "string"
    },
    "task_id": {
      "type": "string",
      "description": "Görev ID (örn: TRIVIAL-001, REC-25 vs.)"
    },
    "task_title": {
      "type": "string",
      "description": "Görev Başlığı"
    },
    "description": {
      "type": "string",
      "minLength": 10,
      "description": "Görevin neden 'trivial' sayıldığına dair teknik açıklama. Bu, sistemin bypass edilmesi riskini en aza indirmek içindir."
    },
    "files_modified": {
      "type": "array",
      "minItems": 1,
      "items": {
        "type": "string"
      },
      "description": "Değiştirilen dosyaların listesi."
    },
    "domain_ref": {
      "type": "string",
      "description": ".agent/domains/ altındaki ilgili domain sınır dosyasının adı (örnek: _template-domain.md). Bu kurallar Scope Police tarafından otomatik olarak denetlenecektir."
    },
    "allowed_paths": {
      "type": "array",
      "items": { "type": "string" },
      "minItems": 1,
      "description": "Dokunulmasına izin verilen klasör veya glob yolları (örnek: src/components/pdp/** veya src/app/page.tsx). Eğer bir path buraya eklenmediyse, Scope Police ajanı acımasızca reddedecektir."
    },
    "forbidden_paths": {
      "type": "array",
      "items": { "type": "string" },
      "description": "Kesinlikle DOKUNULMAMASI gereken dosya yolları. Eğer ajan işin buraya girebileceğini düşünüyorsa işi planlamamalıdır."
    },
    "max_files_changed": {
      "type": "integer",
      "minimum": 1,
      "maximum": 5,
      "description": "Bu görevin dosya değiştirme bütçesi. Trivial görevler için maksimum sınır 5'tir. Aşarsanız plan hazırlamanız zorunludur."
    },
    "allowed_change_types": {
      "type": "array",
      "minItems": 1,
      "items": { "type": "string" },
      "description": "Değişim türleri örn: ui_spacing, component_refactor, api_change, db_migration vb."
    },
    "verification_commands": {
      "type": "array",
      "minItems": 1,
      "items": {
        "type": "object",
        "required": [
          "command",
          "result",
          "passed"
        ],
        "properties": {
          "command": {
            "type": "string",
            "minLength": 3
          },
          "result": {
            "type": "string"
          },
          "passed": {
            "type": "boolean"
          }
        }
      },
      "description": "Çalıştırılan doğrulama komutları (Ruff, Pytest)."
    },
    "all_passed": {
      "type": "boolean"
    }
  },
  "additionalProperties": false
}
