{
  "skill": "superpowers-trivial",
  "model": "",
  "date": "",
  "task_id": "P00-036",
  "task_title": "Front-End Tech Debt Eradication",
  "description": "",
  "files_modified": [],
  "allowed_paths": [
    "src/**/front/**"
  ],
  "forbidden_paths": [],
  "max_files_changed": 5,
  "allowed_change_types": [],
  "verification_commands": [
    {
      "command": "pnpm run lint:ci",
      "result": "",
      "passed": false
    },
    {
      "command": "pnpm exec tsc -b tsconfig.build.json",
      "result": "",
      "passed": false
    },
    {
      "command": "pnpm test -- --run",
      "result": "",
      "passed": false
    }
  ],
  "all_passed": false
}