{
  "skill": "superpowers-trivial",
  "model": "gemini-pro",
  "date": "2026-04-05",
  "task_id": "P06-999",
  "task_title": "refactor(3d-discovery): apple-tier vacuum animation",
  "description": "Animation refactor in OrbitalProductsShowcase.tsx: fixed startTime race condition (flash fix), removed double-scale conflict from parent group, froze carousel rotation during entry sequence, adjusted startZ to 18.0 for immersive suck-in from camera. All changes confined to a single file, no new dependencies.",
  "files_modified": [
    "src/components/products/OrbitalProductsShowcase.tsx",
    "src/components/ui/VentImage.tsx",
    "registry/registry.db",
    "registry/P06-System-Intelligence-Register/active/999-refactor-3d-vacuum-animation/trivial.json",
    "registry/P01-Visual-Page-Builder/backlog/999-refactor-3d-vacuum-animation/trivial.json"
  ],
  "allowed_paths": [
    "src/components/products/OrbitalProductsShowcase.tsx",
    "src/components/ui/VentImage.tsx",
    "registry/"
  ],
  "forbidden_paths": [
    "supabase/",
    ".env",
    "pnpm-lock.yaml"
  ],
  "max_files_changed": 5,
  "allowed_change_types": [
    "component_refactor",
    "animation_fix",
    "performance_improvement"
  ],
  "verification_commands": [
    {
      "command": "npx tsc --noEmit",
      "result": "Exit code 0, no errors",
      "passed": true
    },
    {
      "command": "npm run lint",
      "result": "Exit code 0, no lint errors",
      "passed": true
    }
  ],
  "all_passed": true
}
